<?xml version="1.0" encoding="UTF-8"?>
<!--
     Electronic Court Filing Version 5.0
     Committee Specification 01
     18 April 2019
     Copyright (c) OASIS Open 2019. All Rights Reserved.
     Source: https://docs.oasis-open.org/legalxml-courtfiling/ecf/v5.0/cs01/examples/
     Latest version of narrative specification: http://docs.oasis-open.org/legalxml-courtfiling/ecf/v5.0/ecf-v5.0.html
     TC IPR Statement: https://www.oasis-open.org/committees/legalxml-courtfiling/ipr.php 
-->
<!-- Modifications:
	
		Added nc:IdentificationCategoryDescriptionText and nc:IdentificationSourceText for messageID.
		Added message Id from the request message (e.g. GetPolicyRequestMessage) as required per specification.

-->
<policyresponse:GetPolicyResponseMessage xmlns:policyresponse="https://docs.oasis-open.org/legalxml-courtfiling/ns/v5.0/policyresponse" xmlns:nc="http://release.niem.gov/niem/niem-core/4.0/" xmlns:j="http://release.niem.gov/niem/domains/jxdm/6.1/" xmlns:ecf="https://docs.oasis-open.org/legalxml-courtfiling/ns/v5.0/ecf" xmlns:xsi="http://www.w3.org/2001/XMLSchema-instance" xsi:schemaLocation="https://docs.oasis-open.org/legalxml-courtfiling/ns/v5.0/policyresponse ../schema/policyresponse.xsd">
	<nc:DocumentIdentification>
		<nc:IdentificationID>10</nc:IdentificationID>
		<nc:IdentificationCategoryDescriptionText>messageID</nc:IdentificationCategoryDescriptionText>
		<nc:IdentificationSourceText>CourtPolicy</nc:IdentificationSourceText>
	</nc:DocumentIdentification>
	<nc:DocumentIdentification>
		<nc:IdentificationID>123456ABC</nc:IdentificationID>
		<nc:IdentificationCategoryDescriptionText>messageID</nc:IdentificationCategoryDescriptionText>
		<nc:IdentificationSourceText>FilingAssembly</nc:IdentificationSourceText>
	</nc:DocumentIdentification>
	<ecf:DocumentAugmentation>
		<ecf:DocumentFiler>
			<nc:EntityPerson>
				<ecf:PersonAugmentation>
					<ecf:ParticipantID>
						<nc:IdentificationID>10</nc:IdentificationID>
					</ecf:ParticipantID>
				</ecf:PersonAugmentation>
			</nc:EntityPerson>
		</ecf:DocumentFiler>
	</ecf:DocumentAugmentation>
	<ecf:SendingMDELocationID>
		<nc:IdentificationID>https://efilingmanager.com:8000</nc:IdentificationID>
	</ecf:SendingMDELocationID>
	<ecf:ServiceInteractionProfileCode>urn:oasis:names:tc:legalxml-courtfiling:schema:xsd:WebServicesMessaging-5.0</ecf:ServiceInteractionProfileCode>
	<j:CaseCourt>
		<nc:OrganizationIdentification>
			<nc:IdentificationID>01</nc:IdentificationID>
		</nc:OrganizationIdentification>
		<j:CourtName>King County Superior Court</j:CourtName>
	</j:CaseCourt>
	<nc:DocumentPostDate>
		<nc:DateTime>2007-06-06T14:20:47.0Z</nc:DateTime>
	</nc:DocumentPostDate>
	<nc:Metadata>
		<nc:EffectiveDate>
			<nc:DateTime>2007-06-06T14:20:47.0Z</nc:DateTime>
		</nc:EffectiveDate>
		<nc:LastUpdatedDate>
			<nc:DateTime>2007-06-06T14:20:47.0Z</nc:DateTime>
		</nc:LastUpdatedDate>
	</nc:Metadata>
	<policyresponse:DevelopmentPolicy>
		<policyresponse:AcceptConfidentialFilingsIndicator>true</policyresponse:AcceptConfidentialFilingsIndicator>
		<policyresponse:AcceptDocumentsRequiringFeesIndicator>true</policyresponse:AcceptDocumentsRequiringFeesIndicator>
		<policyresponse:AcceptMultipleLeadDocumentsIndicator>false</policyresponse:AcceptMultipleLeadDocumentsIndicator>
		<policyresponse:FilingFeesMayBeApplicableIndicator>true</policyresponse:FilingFeesMayBeApplicableIndicator>
		<policyresponse:MajorDesignElement>
			<policyresponse:MajorDesignElementLocationID>
				<nc:IdentificationID>https://efsp.com:8000</nc:IdentificationID>
			</policyresponse:MajorDesignElementLocationID>
			<policyresponse:MajorDesignElementTypeCode>FilingAssembly</policyresponse:MajorDesignElementTypeCode>
			<policyresponse:SupportedOperations>
				<policyresponse:OperationNameCode>NotifyCourtDate</policyresponse:OperationNameCode>
				<policyresponse:OperationNameCode>NotifyFilingReviewComplete</policyresponse:OperationNameCode>
			</policyresponse:SupportedOperations>
			<policyresponse:SupportedServiceInteractionProfiles>
				<ecf:ServiceInteractionProfileCode>urn:oasis:names:tc:legalxml-courtfiling:schema:xsd:WebServicesMessaging-5.0</ecf:ServiceInteractionProfileCode>
			</policyresponse:SupportedServiceInteractionProfiles>
		</policyresponse:MajorDesignElement>
		<policyresponse:MajorDesignElement>
			<policyresponse:MajorDesignElementLocationID>
				<nc:IdentificationID>https://efsp.com:8000</nc:IdentificationID>
			</policyresponse:MajorDesignElementLocationID>
			<policyresponse:MajorDesignElementTypeCode>Service</policyresponse:MajorDesignElementTypeCode>
			<policyresponse:SupportedOperations>
				<policyresponse:OperationNameCode>ServeFiling</policyresponse:OperationNameCode>
				<policyresponse:OperationNameCode>ServeProcess</policyresponse:OperationNameCode>
			</policyresponse:SupportedOperations>
			<policyresponse:SupportedServiceInteractionProfiles>
				<ecf:ServiceInteractionProfileCode>urn:oasis:names:tc:legalxml-courtfiling:schema:xsd:WebServicesMessaging-5.0</ecf:ServiceInteractionProfileCode>
			</policyresponse:SupportedServiceInteractionProfiles>
		</policyresponse:MajorDesignElement>
		<policyresponse:MajorDesignElement>
			<policyresponse:MajorDesignElementLocationID>
				<nc:IdentificationID>https://efilingmanager.com:8000</nc:IdentificationID>
			</policyresponse:MajorDesignElementLocationID>
			<policyresponse:MajorDesignElementTypeCode>CourtPolicy</policyresponse:MajorDesignElementTypeCode>
			<policyresponse:SupportedOperations>
				<policyresponse:OperationNameCode>GetPolicy</policyresponse:OperationNameCode>
			</policyresponse:SupportedOperations>
			<policyresponse:SupportedServiceInteractionProfiles>
				<ecf:ServiceInteractionProfileCode>urn:oasis:names:tc:legalxml-courtfiling:schema:xsd:WebServicesMessaging-5.0</ecf:ServiceInteractionProfileCode>
			</policyresponse:SupportedServiceInteractionProfiles>
		</policyresponse:MajorDesignElement>
		<policyresponse:MajorDesignElement>
			<policyresponse:MajorDesignElementLocationID>
				<nc:IdentificationID>https://efilingmanager.com:8000</nc:IdentificationID>
			</policyresponse:MajorDesignElementLocationID>
			<policyresponse:MajorDesignElementTypeCode>FilingReview</policyresponse:MajorDesignElementTypeCode>
			<policyresponse:SupportedOperations>
				<policyresponse:OperationNameCode>CancelFiling</policyresponse:OperationNameCode>
				<policyresponse:OperationNameCode>GetFeesCalculation</policyresponse:OperationNameCode>
				<policyresponse:OperationNameCode>GetFilingList</policyresponse:OperationNameCode>
				<policyresponse:OperationNameCode>GetFilingStatus</policyresponse:OperationNameCode>
				<policyresponse:OperationNameCode>GetServiceInformation</policyresponse:OperationNameCode>
				<policyresponse:OperationNameCode>NotifyDocketingComplete</policyresponse:OperationNameCode>
				<policyresponse:OperationNameCode>NotifyDocumentStampInformation</policyresponse:OperationNameCode>
				<policyresponse:OperationNameCode>ReviewFiling</policyresponse:OperationNameCode>
			</policyresponse:SupportedOperations>
			<policyresponse:SupportedServiceInteractionProfiles>
				<ecf:ServiceInteractionProfileCode>urn:oasis:names:tc:legalxml-courtfiling:schema:xsd:WebServicesMessaging-5.0</ecf:ServiceInteractionProfileCode>
			</policyresponse:SupportedServiceInteractionProfiles>
		</policyresponse:MajorDesignElement>
		<policyresponse:MajorDesignElement>
			<policyresponse:MajorDesignElementLocationID>
				<nc:IdentificationID>https://courtscheduling.com:8000</nc:IdentificationID>
			</policyresponse:MajorDesignElementLocationID>
			<policyresponse:MajorDesignElementTypeCode>CourtScheduling</policyresponse:MajorDesignElementTypeCode>
			<policyresponse:SupportedOperations>
				<policyresponse:OperationNameCode>GetCourtSchedule</policyresponse:OperationNameCode>
				<policyresponse:OperationNameCode>NotifyCourtDate</policyresponse:OperationNameCode>
				<policyresponse:OperationNameCode>ReserveCourtDate</policyresponse:OperationNameCode>
			</policyresponse:SupportedOperations>
			<policyresponse:SupportedServiceInteractionProfiles>
				<ecf:ServiceInteractionProfileCode>urn:oasis:names:tc:legalxml-courtfiling:schema:xsd:WebServicesMessaging-5.0</ecf:ServiceInteractionProfileCode>
			</policyresponse:SupportedServiceInteractionProfiles>
		</policyresponse:MajorDesignElement>
		<policyresponse:MajorDesignElement>
			<policyresponse:MajorDesignElementLocationID>
				<nc:IdentificationID>https://courtrecord.com:8000</nc:IdentificationID>
			</policyresponse:MajorDesignElementLocationID>
			<policyresponse:MajorDesignElementTypeCode>CourtRecord</policyresponse:MajorDesignElementTypeCode>
			<policyresponse:SupportedOperations>
				<policyresponse:OperationNameCode>AllocateCourtDate</policyresponse:OperationNameCode>
				<policyresponse:OperationNameCode>DocumentStampInformation</policyresponse:OperationNameCode>
				<policyresponse:OperationNameCode>GetCase</policyresponse:OperationNameCode>
				<policyresponse:OperationNameCode>GetCaseList</policyresponse:OperationNameCode>
				<policyresponse:OperationNameCode>GetDocument</policyresponse:OperationNameCode>
				<policyresponse:OperationNameCode>GetServiceInformation</policyresponse:OperationNameCode>
				<policyresponse:OperationNameCode>RecordDocketing</policyresponse:OperationNameCode>
			</policyresponse:SupportedOperations>
			<policyresponse:SupportedServiceInteractionProfiles>
				<ecf:ServiceInteractionProfileCode>urn:oasis:names:tc:legalxml-courtfiling:schema:xsd:WebServicesMessaging-5.0</ecf:ServiceInteractionProfileCode>
			</policyresponse:SupportedServiceInteractionProfiles>
		</policyresponse:MajorDesignElement>
		<policyresponse:MaximumAllowedAttachmentPageQuantity>1000</policyresponse:MaximumAllowedAttachmentPageQuantity>
		<policyresponse:MaximumAllowedAttachmentSize>